<?xml version="1.0" encoding="UTF-8"?>

        <!-- Para probar el XSD 
            1 bloquea toda la parte de abajo 
            2 desbloquea el comentario siguiente del comentario XSD  -->

<?xml-stylesheet type="text/xsl" href="file:biblioteca.xsl"?>
<biblioteca> 
             <!-- bloquear hasta aqui -->


            <!--   XSD  -->
<!-- <biblioteca xmlns:xsi="http://www.w3.org/2001/XMLSchema-instance" xsi:noNamespaceSchemaLocation="biblioteca.xsd">   -->
            <!-- desbloquea hasta aqui -->

    <productos cod="A01-54">
        <libros>
            <nombre>Caperucita Roja</nombre>
            <autor>Mario Turrientes</autor>
            <codigo>87.YUI-98-P</codigo>
            <precio>6</precio>
            <fecha>1999-09-18</fecha>
        </libros>
        <libros>
            <nombre>Piratas del Caribe</nombre>
            <autor>Maria Casillas</autor>
            <codigo>46.UYT+42-P</codigo>
            <precio>6</precio>
            <fecha>1999-09-18</fecha>
        </libros>
        <libros>
            <nombre>Los tres cerditos</nombre>
            <autor>Antonio Buendia</autor>
            <codigo>89.AGT-78-Y</codigo>
            <precio>7</precio>
            <fecha>1999-09-18</fecha>
        </libros>
        <libros>
            <nombre>Blanca Nieves</nombre>
            <autor>Alex Polo</autor>
            <codigo>77.YPO+98-P</codigo>
            <precio>6</precio>
            <fecha>1999-09-18</fecha>
        </libros>
        <libros>
            <nombre>Cenicienta</nombre>
            <autor>Gabriela Arechua</autor>
            <codigo>65.ERT+78-Y</codigo>
            <precio>6</precio>
            <fecha>1999-09-18</fecha>
        </libros>
        <revista>
            <nombre>Pop</nombre>
            <editorial>Lope de vega</editorial>
            <codigo>89.AGT+78-Y</codigo>
            <precio>9</precio>
            <fecha>1999-09-18</fecha>
        </revista>
    </productos>
    <cliente>
        <nombre>Katherine</nombre>
        <apellido>Ortiz</apellido>
        <apellido>Ortiz</apellido>
        <codigo>89.AGT+78-Y</codigo>
        <dni>78654909-A</dni>
        <telefono>68754908</telefono>
        <direccion>calle San Bernardo </direccion>
    </cliente>

</biblioteca>